{
  "command_id": "cmd-api-worker-01",
  "action": "spawn",
  "actor_path": "/root/manager/tl_api",
  "actor_role": "team_leader",
  "parent_path": "/root/manager/tl_api",
  "task_name": "w_task_example_01_a1",
  "agent_type": "worker_terra",
  "model": "gpt-5.6-terra",
  "reasoning_effort": "medium",
  "fork_turns": "none",
  "message_ref": "artifact://messages/task-example-01-a1",
  "delegation_permit_ref": "artifact://permits/permit-api-wave-01",
  "role_card_ref": "artifact://roles/role-api-worker-01",
  "context_capsule_ref": "artifact://capsules/task-example-01-a1",
  "reason": "Approved dependency-ready assignment.",
  "budget_reservation": {
    "thread_slots": 1,
    "max_children": 0,
    "token_or_time_class": "standard"
  },
  "created_at": "2026-07-14T00:00:00Z"
}
